<?xml version="1.0"?>
<!--Create an XML document Student where it contains the following data:
Student(Name (fname & Lname) , ID , Plan (courses) ). In
courses element take (year) as an attribute and (course) as an
sub-element . And Course has name , shortName , record as its
sub element. And again record has its sub element Grade , date.
Create An External DTD for the above XML document where :
• Courses element can zero or more course.
• Year attribute must appear in the element.
• Record element should appear zero or more times-->
<!DOCTYPE Student SYSTEM "ch2_6.dtd">
<Student>
	<Name>
		<fname>Sujal</fname>
		<lname>Prajapati</lname>
	</Name>
	<Id>201</Id>
	<Plan>
		<courses year="2024">
			<course>
				<c_name>imscit</c_name>
				<shortName>it</shortName>
				<record>
					<grade>A</grade>
					<date>05/07/2023</date>
				</record>
			</course>
		</courses>
		<courses year="2024">
			<course>
				<c_name>imscit</c_name>
				<shortName>it</shortName>
				<record>
					<grade>A</grade>
					<date>05/07/2023</date>
				</record>
			</course>
		</courses>
	</Plan>
</Student>